{"schema_id":"execution-package","schema_version":"1.0.0","q_id":"Q-DEMO-001","execution_id":"exec-001","correlation_id":"corr-001","repository":{"repository_id":"GDS-DOCS","root":"C:/GitHub/Ghost-Development-System-Docs","branch":"main","expected_head":"1111111111111111111111111111111111111111"},"approved_q":{"status":"APPROVED"},"mutation_authority":"DOCUMENTATION_ONLY","allowed_paths":["docs/contracts/"],"prohibited_paths":["src/"],"required_capabilities":["filesystem.read"],"validation_commands":["git diff --check"],"completion_gate":["schema validation passes"],"approval_references":[{"approval_id":"approval-exec-001","approval_type":"EXECUTION","subject_type":"Q","subject_id":"Q-DEMO-001","issued_by":"human-owner","issued_at":"2026-07-25T00:00:00Z","expires_at":null,"scope_digest":"sha256:aaaaaaaaaaaaaaaaaaaaaaaaaaaaaaaaaaaaaaaaaaaaaaaaaaaaaaaaaaaaaaaa","repository_id":"GDS-DOCS","branch":"main","remote":"origin","expected_head":"1111111111111111111111111111111111111111","allowed_paths":["docs/contracts/"],"allowed_operations":["filesystem.write"],"safe_commit_set_digest":null,"conditions":["documentation only"],"invalidation_conditions":["HEAD changed"],"status":"ACTIVE"}],"source_artifact_references":["artifact-q-001"],"context_package":{"source_of_truth":"GDS-DOCS"},"classification":"INTERNAL","retention_class":"WORKFLOW_90D","execution_timeout_seconds":3600,"retry_safety":"SAFE"}
